{
  "expiresAt": "2026-07-15T00:00:00Z",
  "issuedAt": "2026-07-14T00:00:00Z",
  "registryId": "fixture",
  "sequence": 42,
  "signature": {
    "algorithm": "ed25519",
    "keyId": "fixture-2026",
    "value": "1L07Cln68AkazAn+5ZdYv2djbKRUkMO86ewFVeaomMF8Y0cgY94sYx6wlwmpMK2dXSusqN6/0/3eRtX7PNxwAQ=="
  },
  "spec": "soksak-spec-registry@0.0.1",
  "units": [
    {
      "id": "terminal-common",
      "kind": "kit",
      "manifest": {
        "sha256": "e1677008286d7cedfbf32cab03a85b3c32c6e798b8c0625da5ab4c5ba4281f72",
        "url": "https://github.com/example/terminal-common/releases/download/terminal-common-v0.0.1/terminal-common.release.json"
      },
      "reports": [
        {
          "sha256": "1a7a0a1b877c1965ef967fde8f6f775e0cbe52430a1196c2d68318d041101cf0",
          "url": "https://github.com/example/terminal-common/releases/download/terminal-common-v0.0.1/kit-kind.conformance.json"
        },
        {
          "sha256": "1901fd6539e4369fa879d0dd6f4d4e1fe94566fa74e651063961cc52b26d44de",
          "url": "https://github.com/example/terminal-common/releases/download/terminal-common-v0.0.1/kit-release.conformance.json"
        }
      ],
      "version": "0.0.1"
    },
    {
      "id": "weather-plugin",
      "kind": "plugin",
      "manifest": {
        "sha256": "8e85d25ce14f348183ea3b352371e96c496d3c8d210f260cc33c443db27c5f43",
        "url": "https://github.com/example/weather-plugin/releases/download/v0.0.1/weather-plugin.release.json"
      },
      "reports": [
        {
          "sha256": "a528386534de4ebf83679712803de12bb2d95c1cfd7aaa411db071504ef71aaa",
          "url": "https://github.com/example/weather-plugin/releases/download/v0.0.1/plugin-kind.conformance.json"
        },
        {
          "sha256": "b6e31b38a598af466e25a3fa56f7c0954c25fcb5b5ce383c9002431436b7b74d",
          "url": "https://github.com/example/weather-plugin/releases/download/v0.0.1/plugin-release.conformance.json"
        }
      ],
      "version": "0.0.1"
    },
    {
      "id": "weather-sidecar",
      "kind": "sidecar",
      "manifest": {
        "sha256": "cb85e8b0e048dafad6464b1b56a84a733233e4a86b2b729f549b85a37998947b",
        "url": "https://github.com/example/weather-sidecar/releases/download/weather-sidecar-v0.0.1/weather-sidecar.release.json"
      },
      "reports": [
        {
          "sha256": "0500776ad10ff6dd1d0d4660cbf1b79e1a78d360ea2c4243e8cebfcfe8c5925e",
          "url": "https://github.com/example/weather-sidecar/releases/download/weather-sidecar-v0.0.1/sidecar-interface.conformance.json"
        },
        {
          "sha256": "1873e3a2d35759439e0bc0b83523a77c107cd34929a4a0d51af67e5fa7dde2ce",
          "url": "https://github.com/example/weather-sidecar/releases/download/weather-sidecar-v0.0.1/sidecar-kind.conformance.json"
        },
        {
          "sha256": "ff52021809084b00ae091516cfe26b4bd311d0aabe72f652a464873a8dab6a20",
          "url": "https://github.com/example/weather-sidecar/releases/download/weather-sidecar-v0.0.1/sidecar-release.conformance.json"
        }
      ],
      "version": "0.0.1"
    }
  ]
}
